b'SiR',7.6,b'Her Too EP',0,b'Rap',b'February 22 2017',"b'The Top Dawg label\xe2\x80\x99s latest signee is Inglewood-bred crooner\xc2\xa0Sir Darryl Farris, aka SiR. His latest EP embraces restraint and subtlety\xe2\x80\x94a pure, 18-minute jolt\xc2\xa0of traditionalist R&B.'","b'Since the early 2000s, the proprietors of the TDE label\xe2\x80\x94Anthony \xe2\x80\x9cTop Dawg\xe2\x80\x9d Tiffith, Dave \xe2\x80\x9cMiyatola\xe2\x80\x9d Free, and Terrence \xe2\x80\x9cPunch\xe2\x80\x9d Henderson\xe2\x80\x94have made\xc2\xa0a\xc2\xa0home for\xc2\xa0more critical darlings per capita than perhaps any other hip-hop-dominated outpost. Each of the last three acts signed to TDE (SZA, Lance Skiiiwalker, SiR) have been R&B artists, an indication that the moment\xe2\x80\x99s hottest rap label is perhaps looking to expand its palate.' b'The latest signee is Sir Darryl Farris, aka SiR, an Inglewood-born-and-bred crooner who has spent years following in the footsteps of his older brothers, the songwriters Daniel and Davion Farris (aka WoodWorks), writing for\xc2\xa0artists behind the scenes.\xc2\xa0It\xe2\x80\x99s uncanny for a mainstream R&B newcomer to have started out penning tracks for Jill Scott, Robert Glasper, Stevie Wonder, and Anita Hill\xc2\xa0rather than Drake or Rihanna, but this is central to SiR\xe2\x80\x99s ethos.' b'Her Too is an 18-minute jolt\xc2\xa0of pure, traditionalist R&B and neo-soul. SiR\xe2\x80\x99s\xc2\xa0successes lay in his polish and maturity. In this lane, his\xc2\xa0peers have recently focused\xc2\xa0on self-discovery, nostalgia ultra, and experiments in\xc2\xa0form, but\xc2\xa0SiR\xe2\x80\x99s concerns are\xc2\xa0in subtlety, restraint, and finesse.\xc2\xa0SiR\xe2\x80\x99s releases, then\xe2\x80\x942016\xe2\x80\x99s HER EP and 2015\xe2\x80\x99s\xc2\xa0Seven Sundays among them\xe2\x80\x94have lacked a masterpiece like his labelmate\xc2\xa0Kendrick Lamar\xe2\x80\x99s \xe2\x80\x9cThe Art of Peer Pressure.\xe2\x80\x9d But\xc2\xa0Her Too contains fantastic analogues to Jay Rock\xe2\x80\x99s\xc2\xa0\xe2\x80\x9cHood Gone Love It,\xe2\x80\x9d which are a purist\xe2\x80\x99s thrill.' b'Much of Her Too feels warm and leisurely. SiR has said he was aiming for something darker than his previous EP, but the project doesn\xe2\x80\x99t live up to that\xc2\xa0description, save for a few bars on the Anderson .Paak- and King Mez-assisted opener \xe2\x80\x9cNew LA.\xe2\x80\x9d King Mez raps, \xe2\x80\x9cMan why we take the murder route?/Shouldn\xe2\x80\x99t we be worried about niggas dying, niggas dying?/Or we could just not say shit and take the Cam Newton scary route.\xe2\x80\x9d As virtually the only patch of lyrics that aren\xe2\x80\x99t explicitly romantic, it\xe2\x80\x99s a bit\xc2\xa0discordant. On it\xe2\x80\x99s face, it\xe2\x80\x99s a whimsical and somewhat\xc2\xa0funny, topical sports reference. But it plays into the pathology that, no matter a black person\xe2\x80\x99s station in life\xe2\x80\x94and even if they\xe2\x80\x99re currently blinded by love and passion\xe2\x80\x94the threat of state-sanctioned violence lingers in the back of the mind, ready to punch itself into the foreground at a moment\xe2\x80\x99s notice.' b'\xe2\x80\x9cNew LA\xe2\x80\x9d is nonetheless the project\xe2\x80\x99s brightest and most buoyant moment. Cardiak samples Drake\xe2\x80\x99s overlooked \xe2\x80\x9cWith You,\xe2\x80\x9d crafting a saccharine trance of a beat. \xe2\x80\x9cOoh Nah Nah\xe2\x80\x9d is a smooth, sultry number featuring Masego\xe2\x80\x99s vocals and darting saxophone; it finds SiR bellowing in a tenor full of lust. Five of the six songs here\xc2\xa0embrace a degree of calm, but the closer \xe2\x80\x9cW$ Boi\xe2\x80\x9d possesses kinetic energy that explodes in\xc2\xa0the chorus, as SiR shouts that he\xe2\x80\x99s a \xe2\x80\x9cwestside boy.\xe2\x80\x9d It\xe2\x80\x99s like SiR\xe2\x80\x99s version of \xe2\x80\x9cUptown Girl,\xe2\x80\x9d which is Billy Joel\xe2\x80\x99s Romeo and Juliet\xe2\x80\x94the template for an endless trove of tales about star-crossed lovers.' b""In his real life, Sir Darryl Farris is about\xc2\xa030, and he\xe2\x80\x99s been with his wife for the better part of a decade. About seven years ago, he was in Hollywood jobless, drug-addicted, and nearly homeless. The W$ Boi returned home and started writing songs in his mother\xe2\x80\x99s house, which eventually turned his life around. SiR proclaims, \xe2\x80\x9cI don't know if she knows/She don\xe2\x80\x99t know what I been through.\xe2\x80\x9d Even amid a song that could afford to be a bit\xc2\xa0more chaotic, the result is a contained personal anthem. SiR\xe2\x80\x99s debut album is slated to come out whenever Top Dawg chooses, but up to this point,\xc2\xa0his story is one of triumph."""
b'Bing & Ruth',8.2,b'No Home of the Mind',0,b'Experimental',b'February 21 2017',"b'On his third proper\xc2\xa0Bing & Ruth album, and first for 4AD,\xc2\xa0David Moore\xe2\x80\x99s electroacoustic minimalism carries its strongest emotional tug. It\xe2\x80\x99s his earthiest and most distinctive record yet.'","b'Bing & Ruth\xe2\x80\x99s music exists in the cracks between. Project leader David Moore has a degree in music and his earlier compositions, found on the 2010 album City Lake, can have the air of the conservatory. So it makes some sense to slot his work in with\xc2\xa0contemporary classical. But the era of classical music Moore\xc2\xa0most frequently evokes\xe2\x80\x94the trance-inducing minimalism of the 1960s and \xe2\x80\x9970s\xe2\x80\x94has at times been filed as new age. And divisions between *that *genre and the more critically acceptable sphere of \xe2\x80\x9cambient,\xe2\x80\x9d a word that sometimes describes Bing & Ruth, have always been porous. Beyond these labels, Bing & Ruth is also hard to pin functionally. Moore\xe2\x80\x99s\xc2\xa0pieces can feel formal, less like \xe2\x80\x9cenvironments\xe2\x80\x9d and more like compositions that need to be tracked carefully over their duration to be understood. Though he\xe2\x80\x99s made music for an ensemble that includes woodwinds and strings, Moore\xc2\xa0also includes processed tapes and production choices that smudge the lines between acoustic and electronic music.' b'On City Lake and 2014\xe2\x80\x99s Tomorrow Was the Golden Age, Moore\xe2\x80\x99s music evoked the best of what had come before him\xe2\x80\x94Philip Glass\xe2\x80\x99 repetition, the emotional shading of Max Richter, Eluvium\xe2\x80\x99s comfort with rock dynamics\xe2\x80\x94but he\xe2\x80\x99s steadily grown into a sound that feels all his own. No Home of the Mind, his third proper album and first for 4AD, is his most distinctive record yet. His working group is still here, but the arrangements on *No Home *feature Moore\xe2\x80\x99s piano much more prominently, and it\xe2\x80\x99s a more focused record. If City Lake and Tomorrow sometimes found him moving between established styles, demonstrating wide-ranging mastery because he can, the new album stays focused on wringing as much feeling as possible out of narrower terrain. And No Home of the Mind is the earthiest Bing & Ruth record yet.\xc2\xa0You can smell the sweat that went into it.' b'One of Moore\xe2\x80\x99s composition signatures is to turn the piano into a drone instrument. Using rapid clusters of repeating notes, Moore creates piano figures that hang in space like clouds of slowly shifting sound, not unlike passages of La Monte Young\xe2\x80\x99s The Well-Tuned Piano or the work of Young acolytes like Michael Harrison. Where the latter two artists are known for using the piano as a tool for overtones via specialized tuning, Moore creates piano-based drones that serve as the basis for his ensemble pieces. The other instruments\xe2\x80\x99 parts exist in relationship to what he\xe2\x80\x99s doing at the keyboard, offering contrasting textures and leading through varying shifts in mood and tone. It\xe2\x80\x99s almost as if all the separate parts come together into a single instrument, one that is \xe2\x80\x9cplayed\xe2\x80\x9d collectively by the Bing & Ruth ensemble.' b'\xe2\x80\x9cStarwood Choker\xe2\x80\x9d starts the album sounding like a continuation of the last Bing & Ruth record\xe2\x80\x99s criss-crossing tapestries of sound. But the record really begins\xc2\xa0to reveal itself on \xe2\x80\x9cAs Much as Possible,\xe2\x80\x9d which finds Moore in the realm of \xe2\x80\x9csolo piano with ambient treatments\xe2\x80\x9d \xc3\xa0 la Brian Eno and Harold Budd\xe2\x80\x99s *The Pearl. *Moore\xe2\x80\x99s chord voicings suggest both gospel music and the spare \xe2\x80\x9cfurniture music\xe2\x80\x9d of Satie. As he moves between modes, extremely subtle bits of tension are introduced, built, and then released, while yawning chasms of drone from the ensemble drift in and out beneath. \xe2\x80\x9cAs Much as Possible\xe2\x80\x9d is Moore\xe2\x80\x99s most tender and affecting piece yet, a filmic work that evokes haunting images on its own.' b'Throughout the rest of No Home, the piano moves between heavy drone (\xe2\x80\x9cForm Takes\xe2\x80\x9d), achingly spare and meditative ballads (\xe2\x80\x9cTo All It\xe2\x80\x9d), and pieces that explore how much can be done with simple repetition (\xe2\x80\x9cThe How of It Sped\xe2\x80\x9d). The tracks flow one into the next, which accentuates the connections between them and makes *No Home *feel like a single massive piece, carefully mapping every inch of its defined terrain. Moore is so gifted at teasing out emotion, it seems inevitable that there will be many film and television scores\xc2\xa0in his future, if he chooses to go that route. If that happens, *No Home of the Mind *will be remembered as his breakthrough, the place where all the pieces from earlier records snapped into place.'"
b'Moon Duo',7.1,b'Occult Architecture Vol. 1',0,b'Rock',b'February 21 2017',"b'The latest LP from Moon Duo builds on\xc2\xa0their\xc2\xa0psychedelic formula\xe2\x80\x94corroded guitars, kraut rhythms, steely grit\xe2\x80\x94and\xc2\xa0allows them to\xc2\xa0indulge their most sinister tendencies.'","b'Four albums deep, Moon Duo have grown somewhat predictable. The collaboration of Wooden Shijps\xe2\x80\x99 guitar-warlock Ripley Johnson and keyboardist Sanae Yamada has always been built on a steady but enjoyable mix of elements: corroded guitars, loopy keyboard lines, krautrock rhythms, and psychedelic strains conjuring\xc2\xa0both the whirling cosmos and droning abyss. Their new album Occult Architecture Vol. 1 does little to alter the formula, but the key to Moon Duo records has always been the strength of the compositions. And those\xc2\xa0already onboard with the band won\xe2\x80\x99t be disappointed by the seven tracks here.' b'Touted as representing the depths and changes of the seasons, Occult Architecture Vol. 1\xc2\xa0delves into the bleaker corners of winter and allows Moon Duo to indulge their most sinister tendencies. Like many a great Moon Duo song, opener \xe2\x80\x9cThe Death Set\xe2\x80\x9d\xc2\xa0is at once swaggering, sexy, and foreboding. Much of their\xc2\xa0music is low-key cinematic; it\xe2\x80\x99s hard to hear \xe2\x80\x9cThe Death Set\xe2\x80\x9d\xe2\x80\x99s\xc2\xa0distorted, slow-motion whoosh or its bone-rattling beat and not imagine a character\xe2\x80\x99s dramatic entrance into an unnerving nightclub. Elsewhere, like on \xe2\x80\x9cCold Fear\xe2\x80\x9d and \xe2\x80\x9cWill of the Devil,\xe2\x80\x9d they use queasy electronic textures to flirt with gothier territory.' b'Well past the lower-fi nature of their earliest work, Moon Duo still don\xe2\x80\x99t operate with a ton\xc2\xa0of dynamic range. But they use those heart-palpitating rhythms and lacerating keyboard lines to build blown-out, end-times\xc2\xa0epics littered with subtle twists. Johnson\xe2\x80\x99s death-drive guitars propel \xe2\x80\x9cCult of Moloch\xe2\x80\x9d forward unwaveringly, but interjections of synth and a second, spiraling guitar part make the song feel like\xc2\xa0it\xe2\x80\x99s reaching for spiritual corners of nature. Closer \xe2\x80\x9cWhite Rose\xe2\x80\x9d\xe2\x80\x94one long synth ride\xe2\x80\x94has a similar effect, winding down a\xc2\xa0road into the distance. Moon Duo haven\xe2\x80\x99t gone full-on mystic, however; the new album maintains the steely grit of its predecessor, Shadow of the Sun**.\xc2\xa0Theirs is music still meant for barreling down desert highways in a stolen car, or for the grind and smog of a third-tier industrial city.' b""That said, Moon Duo isn\xe2\x80\x99t the kind of group to make albums with literal thematic angles. Their style has limits, but discernibility is maybe not the point. Moon Duo\xe2\x80\x99s\xc2\xa0precise mix of traditions and sounds conjures a\xc2\xa0nihilistic cool, an image of leather-jacketed outlaws chain-smoking in dark alleyways in seedy cities. Occult Architecture Vol. 1 is a good record that\xe2\x80\x99s at its best when Moon Duo fully give in to these seductive inklings, like on \xe2\x80\x9cThe Death Set\xe2\x80\x9d or \xe2\x80\x9cCreepin.\xe2\x80\x99\xe2\x80\x9d Sure, we\xe2\x80\x99ve heard the riff from \xe2\x80\x9cCreepin'\xe2\x80\x9d before, but it\xe2\x80\x99s nice to hear it again."""
b'Call Super',7.6,b'Fabric 92',0,b'Electronic',b'February 21 2017',"b'The London DJ born\xc2\xa0Joseph Richmond Seaton crafts a set that channels Fabric\xe2\x80\x99s late-hours ambience, when things get weird and wooly.'","b'At its best, a\xc2\xa0nightclub can be a scale model of utopia, a shared hallucination, an alternate reality that lasts as long as the house lights stay dark. The same holds true for mix CDs. Most merely operate as calling cards for the DJ making them, or flyers for the club promoting them. Occasionally, though, they aspire to be something more ambitious: a postcard from that imaginary place that the best club nights conjure into being out of sheer force of collective will.' b'That\xe2\x80\x99s the context in which Call Super\xe2\x80\x99s Fabric 92 comes to us. The London DJ, aka Joseph Richmond Seaton, says that he intended the release\xc2\xa0as a snapshot of the late hours of his sets, when consensus floor-fillers give way to stranger, more personal selections. That\xe2\x80\x99s one unusual thing about the mix; another is that it was born in the wild, but raised in captivity, as it were. His choice of theme and mood reflects a careful study of Fabric\xe2\x80\x99s mix series as much as it does his time in the booth at the London venue. Noticing that the late hours seemed \xe2\x80\x9cstrangely under represented\xe2\x80\x9d within the series, he writes, \xe2\x80\x9cI thought it would be good to start there instead of using this opportunity to add another peak-time chapter to the collection.\xe2\x80\x9d' b'Commercial mix CDs have lost the central role in DJ culture that they enjoyed in the \xe2\x80\x9990s and \xe2\x80\x9900s; thanks to the internet, mixes are everywhere now, and free. But, perhaps precisely because no one has time to listen to even a fraction of them, Fabric\xe2\x80\x99s series is more of a canon-maker than ever. Fabric 92 is, above all, a testament to digging widely and without prejudice. Beneath house and techno\xe2\x80\x99s broad umbrella, it\xe2\x80\x99s as diverse a set as you\xe2\x80\x99ll find, spanning multiple eras, styles, and scenes, and boasting a final 14 minutes that veers way out into the deep end, from drone to country blues to polemical dancehall reggae.' b'Seaton\xe2\x80\x99s selections are spellbinding, as\xc2\xa0every track presents a self-contained world of its own. Some, like Don\xe2\x80\x99t DJ\xe2\x80\x99s polyrhythmic \xe2\x80\x9cPornoire,\xe2\x80\x9d are wildly complex; others, like the flickering electro of Shanti Celeste\xe2\x80\x99s \xe2\x80\x9cStrung Up,\xe2\x80\x9d are relatively tidy. The cumulative effect of the way he layers and strings them all together is akin to moving through a series of wormholes, flashing from landscape to landscape while standing in place. His mixing is never ostentatious, but it generally emphasizes action. It\xe2\x80\x99s rare that a song is left to play out unaccompanied; far more often, he\xe2\x80\x99s got two and even three tracks running in parallel, resulting in a dynamic, shape-shifting fusion that\xe2\x80\x99s far more than the sum of its parts. Early on, he combines muted, shuffling cuts from Jan Jelinek and from Wolfgang Voigt\xe2\x80\x99s M:I:5 project to mossy\xc2\xa0effect, as though burrowing through underbrush, while using the doleful trumpet of Beatrice Dillon and Rupert Clervaux\xe2\x80\x99s \xe2\x80\x9cThe Same River Twice\xe2\x80\x9d\xc2\xa0to draw bright, silvery streaks overhead.' b'A few tracks later, following an early climax brought on by his friend Objekt\xe2\x80\x99s \xe2\x80\x9cThe Stitch-Up\xe2\x80\x9d\xe2\x80\x94whipcracks, shrapnel, a heart-in-mouth ostinato\xe2\x80\x94he turns to relatively obscure, mid-\xe2\x80\x9990s cuts from Photek and Two Full Minds to create a subaquatic atmosphere. That relative calm sets up the mix\xe2\x80\x99s most white-knuckled passage, in which Flanger\xe2\x80\x99s head-scratching \xe2\x80\x9cSpinner,\xe2\x80\x9d in 10/4 time, is teased in and out of Carl Craig\xe2\x80\x99s epic \xe2\x80\x9cA Wonderful Life\xe2\x80\x9d for three minutes of tug-of-war. At several points, it feels like it could all collapse into the mud at any moment, but it\xe2\x80\x99s precisely that sense of risk that\xe2\x80\x99s so exhilarating.' b""On the downhill slope, Seaton switches into a more sentimental gear, leaning heavily on melodic IDM and electro from Marco Bernardi, Jega, Shanti Celeste, and Bitstream; concluding with a fleet-footed Detroit techno skip from Convextion, this might be the set\xe2\x80\x99s most satisfying segment. But Seaton has one final trick up his sleeve. As Convextion\xe2\x80\x99s beats fade away, a pair of ambient drones from Karen Gwyer and Thomas Ankersmit & Valerio Tricoli shimmer brightly in the darkness, and a lilting, sing-song speaking voice rings out: \xe2\x80\x9cWell I\xe2\x80\x99m just walkin\xe2\x80\x99/I\xe2\x80\x99m trying to find the end/But every time I stop/Look like my trouble just begin.\xe2\x80\x9d It\xe2\x80\x99s Walter Brown's \xe2\x80\x9cKeep on\xc2\xa0Walkin\xe2\x80\x99,\xe2\x80\x9d an a cappella country blues recorded in Mississippi in 1981 by a pair of German ethnomusicologists."" b'It\xe2\x80\x99s hardly the first time that archival blues has turned up in dance music\xe2\x80\x94Moby, you may recall, built his empire on wringing as much authenticity as he could out of vintage recordings of black Americans\xe2\x80\x99 voices. But Seaton\xe2\x80\x99s approach, which sets Brown\xe2\x80\x99s rueful blues in an imaginary summer night, lit only by stars and fireflies, is far stranger. And in the context of a club set, it\xe2\x80\x99s nothing short of audacious. Eventually, Yves Tumor\xe2\x80\x99s woozy, soulful \xe2\x80\x9cThe Feeling When You Walk Away\xe2\x80\x9d takes us by the hand and leads us back toward the light, and Speng Bond\xe2\x80\x99s \xe2\x80\x9cCutbacks,\xe2\x80\x9d a dancehall reggae tune about economic austerity policies, sends us home feeling righteous. But for just a moment there, at the tail end of the set\xe2\x80\x99s spellbinding denouement, everything falls silent as Walter Brown\xe2\x80\x99s plaintive voice carries on unaccompanied: \xe2\x80\x9cOn my knees, I\xe2\x80\x99m gonna just/Keep on walkin\xe2\x80\x99.\xe2\x80\x9d In a journey full of left turns and switchbacks, this calm, quiet testament to faith and fortitude speaks the loudest; it\xe2\x80\x99s a moment when absolutely anything feels possible.'"
b'Earthen Sea',8.1,b'An Act of Love',0,b'Electronic',b'February 21 2017',b'The minimal dub-techno landscapes that Jacob Long makes as Earthen Sea carry a sense of refinement and grace. Each element of his Kranky debut is radiant.',"b'It\xe2\x80\x99s rare to have any vocals appear on of the fog-enshrouded landscapes that Jacob Long devises as Earthen Sea. But earlier this month, Long cleared out his hard drive with A Serious Thing, a nine-track compilation of tracks recorded in the past three years (with all proceeds going to the International Refugee Assistance Project, American-Arab Anti-Discrimination Committee, and the National Lawyers Guild). Less than a minute in, the voice of firebrand gay Harlem intellectual James Baldwin emerges from the mists and speaks of the crucial role of dreamers\xc2\xa0in their respective societies. \xe2\x80\x9cThe poets (by which I mean all artists) are finally the only people who know the truth about us,\xe2\x80\x9d Baldwin said. \xe2\x80\x9cSoldiers don\xe2\x80\x99t, statesmen don\xe2\x80\x99t, priests don\xe2\x80\x99t, union leaders don\xe2\x80\x99t. Only the poets.\xe2\x80\x9d' b'And while there are no words and no voices that appear on An Act of Love, Long\xe2\x80\x99s debut for Kranky, that poet\xe2\x80\x99s search for an undeniable truth powers the eight breathtaking tracks that appear here. A hardcore veteran who\xe2\x80\x99s played in D.C. bands like Amalgamation and Black Eyes, Long later played bass in the adventurous punk act Mi Ami. Over time, that trio mutated from art-rock towards the sounds of Chicago house and Jamaican dub, soon splintering into three separate electronic acts: drummer Damon Palermo became Magic Touch and guitarist Daniel Martin-McCormick became Ital.' b'Long himself took the foundations of dub as the starting point for his next iteration, Earthen Sea. Much like the godfathers of minimal techno\xe2\x80\x94Moritz von Oswald and Mark Ernestus, Vladislav Delay circa Multila,\xc2\xa0the entire Chain Reaction roster\xe2\x80\x94Long realized there was sublimity to be had in endless reverb, delay, and its sonic residue. And with 2014\xe2\x80\x99s Mirage, released on Martin-McCormick\xe2\x80\x99s Lovers Rock label, Earthen Sea\xe2\x80\x99s aesthetic solidified. An Act of Love is a continuation of that effort, though there\xe2\x80\x99s a feeling\xc2\xa0of refinement and awareness that gives each element here a heightened radiance. Even in the buzzing static and air organ chords that comprise beatless opener \xe2\x80\x9cThe Present Mist,\xe2\x80\x9d there\xe2\x80\x99s a sense of grace, of deep breaths being drawn musically that makes it standout from other ambient noise of its ilk.' b'Earthen Sea makes\xc2\xa0minimal dub techno, but while Long\xe2\x80\x99s components are suggestive of dance music\xe2\x80\x94especially the 707 that drives most of the tracks\xe2\x80\x94the context for each programmed hit seems to not be a packed club. Rather, Earthen Sea could soundtrack\xc2\xa0a depopulated metropolis, each beat bouncing off of concrete. A squelchy kick drives \xe2\x80\x9cAbout That Time\xe2\x80\x9d and other elements wash in: a canned clap, a tapped ride cymbal, a piano line as contemplative and sonorous as that of Harold Budd. But underneath all of that is a gloriously slow swell of white noise, which rises and falls like an incoming tide and is mesmerizing in and of itself.' b'The muffled \xe2\x80\x9cApparent Lushness\xe2\x80\x9d sounds as if it was recorded four feet underwater, its pretty melody reminiscent of something off of J\xc3\xbcrgen M\xc3\xbcller\xe2\x80\x99s Science of the Sea, shining through the ripples. It segues into the centerpiece \xe2\x80\x9cExuberant Burning,\xe2\x80\x9d with Long taking a flare of feedback and making it arc across the sky like a vapor trail. A bass throbs along with the beat, and these elements all hover in place before Long adds live drums and cymbals, and moves the track forward again. A sound not unlike the distant roar of passing cars on a highway comes up, giving the track an uncanny sense of space.' b'After a brief interlude, the album peaks with the muscular kick of \xe2\x80\x9cThe Flats 1975,\xe2\x80\x9d breaking out of the noirish mood of the previous tracks and offering up a sense of much-needed physical release. In the press materials\xc2\xa0for the album, Long noted that the months leading up to the recording of An Act of Love were \xe2\x80\x9cthe most emotionally difficult and stressful year in my life,\xe2\x80\x9d which might be a sentiment shared by most people in the calendar year of 2016. But despite the darkness that intrudes in on the album\xe2\x80\x94from the inky cover to the gloaming sounds within to the despairing environment in which it now enters our present day\xe2\x80\x94there\xe2\x80\x99s nevertheless a small kernel of hope to be gleaned. Long goes on to discuss the inspiration he got from empty city streets in the dead of night and the realization that regardless there are still people all around, as well as \xe2\x80\x9cthe openness and possibilities that [they] can bring.\xe2\x80\x9d While Long only uses a steady beat and some deeply resonant chords to convey this revelation, he nevertheless moves like a poet to unearth that heartening sense of truth here.'"
